{
  "$schema": "https://json-schema.org/draft/2020-12/schema",
  "$id": "https://telperia.org/schemas/evaluation-run.schema.json",
  "title": "Telperia Evaluation Run",
  "description": "Result package for one local Telperia evaluation run.",
  "type": "object",
  "additionalProperties": false,
  "required": [
    "schema_version",
    "run_id",
    "timestamp",
    "model",
    "runtime",
    "hardware",
    "methodology",
    "evaluation",
    "energy",
    "performance",
    "verification"
  ],
  "properties": {
    "schema_version": {
      "const": "0.1"
    },
    "run_id": {
      "type": "string",
      "format": "uuid"
    },
    "timestamp": {
      "type": "string",
      "format": "date-time"
    },
    "model": {
      "type": "object",
      "additionalProperties": false,
      "required": ["name", "revision", "quantization"],
      "properties": {
        "name": {
          "type": "string",
          "minLength": 1
        },
        "revision": {
          "type": "string",
          "minLength": 1
        },
        "quantization": {
          "type": "string",
          "minLength": 1
        }
      }
    },
    "runtime": {
      "type": "object",
      "additionalProperties": false,
      "required": ["engine", "engine_version"],
      "properties": {
        "engine": {
          "type": "string",
          "enum": ["ollama"]
        },
        "engine_version": {
          "type": "string",
          "minLength": 1
        }
      }
    },
    "hardware": {
      "type": "object",
      "additionalProperties": false,
      "required": ["gpu", "gpu_count", "driver", "cuda", "system_ram_gb"],
      "properties": {
        "gpu": {
          "type": "string",
          "minLength": 1
        },
        "gpu_count": {
          "type": "integer",
          "minimum": 1
        },
        "driver": {
          "type": "string",
          "minLength": 1
        },
        "cuda": {
          "type": "string",
          "minLength": 1
        },
        "system_ram_gb": {
          "type": "number",
          "exclusiveMinimum": 0
        }
      }
    },
    "run_environment": {
      "type": "object",
      "additionalProperties": false,
      "required": ["node_id", "operating_system", "monitor_backend"],
      "properties": {
        "node_id": {
          "type": "string",
          "minLength": 1
        },
        "operating_system": {
          "type": "string",
          "minLength": 1
        },
        "monitor_backend": {
          "type": "string",
          "enum": ["disabled", "nvml"]
        }
      }
    },
    "methodology": {
      "type": "object",
      "additionalProperties": false,
      "required": ["version", "documents"],
      "properties": {
        "version": {
          "const": "0.1"
        },
        "documents": {
          "type": "array",
          "minItems": 1,
          "items": {
            "type": "string",
            "minLength": 1
          },
          "uniqueItems": true
        }
      }
    },
    "evaluation": {
      "type": "object",
      "additionalProperties": false,
      "required": ["suite", "completed_tasks", "total_tasks", "scores"],
      "properties": {
        "suite": {
          "type": "string",
          "minLength": 1
        },
        "completed_tasks": {
          "type": "integer",
          "minimum": 0
        },
        "total_tasks": {
          "type": "integer",
          "minimum": 0
        },
        "completion_ratio": {
          "type": "number",
          "minimum": 0,
          "maximum": 1
        },
        "scores": {
          "type": "object",
          "additionalProperties": true,
          "required": [
            "task_score_average",
            "tci_v0_1",
            "factual_reliability_v0_1",
            "ipw_v0_1"
          ],
          "properties": {
            "task_score_average": {
              "type": "number",
              "minimum": 0,
              "maximum": 1
            },
            "tci_v0_1": {
              "type": "object",
              "additionalProperties": false,
              "required": ["methodology_version", "final_score", "categories"],
              "properties": {
                "methodology_version": {
                  "const": "TCI v0.1"
                },
                "final_score": {
                  "type": "number",
                  "minimum": 0,
                  "maximum": 100
                },
                "categories": {
                  "type": "object",
                  "additionalProperties": false,
                  "required": [
                    "reasoning",
                    "coding",
                    "mathematics",
                    "factual_knowledge",
                    "instruction_adherence"
                  ],
                  "properties": {
                    "reasoning": {
                      "$ref": "#/$defs/tci_category"
                    },
                    "coding": {
                      "$ref": "#/$defs/tci_category"
                    },
                    "mathematics": {
                      "$ref": "#/$defs/tci_category"
                    },
                    "factual_knowledge": {
                      "$ref": "#/$defs/tci_category"
                    },
                    "instruction_adherence": {
                      "$ref": "#/$defs/tci_category"
                    }
                  }
                }
              }
            },
            "factual_reliability_v0_1": {
              "type": "object",
              "additionalProperties": false,
              "required": [
                "correct_responses",
                "incorrect_responses",
                "abstentions",
                "total_questions",
                "correctness_rate",
                "incorrect_answer_rate",
                "abstention_rate",
                "attempted_accuracy"
              ],
              "properties": {
                "correct_responses": {
                  "type": "integer",
                  "minimum": 0
                },
                "incorrect_responses": {
                  "type": "integer",
                  "minimum": 0
                },
                "abstentions": {
                  "type": "integer",
                  "minimum": 0
                },
                "total_questions": {
                  "type": "integer",
                  "minimum": 0
                },
                "correctness_rate": {
                  "type": "number",
                  "minimum": 0,
                  "maximum": 1
                },
                "incorrect_answer_rate": {
                  "type": "number",
                  "minimum": 0,
                  "maximum": 1
                },
                "abstention_rate": {
                  "type": "number",
                  "minimum": 0,
                  "maximum": 1
                },
                "attempted_accuracy": {
                  "type": "number",
                  "minimum": 0,
                  "maximum": 1
                }
              }
            },
            "ipw_v0_1": {
              "oneOf": [
                {
                  "type": "object",
                  "additionalProperties": false,
                  "required": ["unscaled", "displayed", "energy_scope", "energy_source"],
                  "properties": {
                    "unscaled": {
                      "type": "number",
                      "minimum": 0
                    },
                    "displayed": {
                      "type": "number",
                      "minimum": 0
                    },
                    "energy_scope": {
                      "const": "local_inference_hardware"
                    },
                    "energy_source": {
                      "const": "local_gpu_telemetry"
                    }
                  }
                },
                {
                  "type": "object",
                  "additionalProperties": false,
                  "required": ["status", "energy_scope", "energy_source", "reason"],
                  "properties": {
                    "status": {
                      "const": "deferred"
                    },
                    "energy_scope": {
                      "const": "local_inference_hardware"
                    },
                    "energy_source": {
                      "const": "unavailable"
                    },
                    "reason": {
                      "type": "string",
                      "minLength": 1
                    }
                  }
                }
              ]
            }
          }
        },
        "raw_results": {
          "type": "array",
          "items": {
            "type": "object",
            "additionalProperties": false,
            "required": [
              "task_id",
              "category",
              "score",
              "success",
              "latency_ms",
              "input_tokens",
              "output_tokens"
            ],
            "properties": {
              "task_id": {
                "type": "string",
                "minLength": 1
              },
              "category": {
                "type": "string",
                "minLength": 1
              },
              "score": {
                "type": "number"
              },
              "success": {
                "type": "boolean"
              },
              "latency_ms": {
                "type": "number",
                "minimum": 0
              },
              "input_tokens": {
                "type": "integer",
                "minimum": 0
              },
              "output_tokens": {
                "type": "integer",
                "minimum": 0
              },
              "error_category": {
                "type": ["string", "null"]
              }
            }
          }
        }
      }
    },
    "energy": {
      "type": "object",
      "additionalProperties": false,
      "required": [
        "gpu_energy_wh",
        "sampling_interval_ms",
        "average_power_w",
        "peak_power_w"
      ],
      "properties": {
        "gpu_energy_wh": {
          "type": "number",
          "minimum": 0
        },
        "sampling_interval_ms": {
          "type": "integer",
          "exclusiveMinimum": 0
        },
        "average_power_w": {
          "type": "number",
          "minimum": 0
        },
        "peak_power_w": {
          "type": "number",
          "minimum": 0
        },
        "raw_power_samples": {
          "type": "array",
          "items": {
            "type": "object",
            "additionalProperties": false,
            "required": ["timestamp", "power_w"],
            "properties": {
              "timestamp": {
                "type": "string",
                "format": "date-time"
              },
              "power_w": {
                "type": "number",
                "minimum": 0
              },
              "interval_s": {
                "type": "number",
                "exclusiveMinimum": 0
              }
            }
          }
        },
        "monitor_backend": {
          "type": "string",
          "enum": ["disabled", "nvml"]
        },
        "energy_scope": {
          "type": "string",
          "enum": ["local_inference_hardware"]
        },
        "energy_source": {
          "type": "string",
          "enum": ["unavailable", "local_gpu_telemetry"]
        },
        "energy_confidence": {
          "type": "object",
          "additionalProperties": false,
          "required": [
            "quality",
            "sample_count",
            "measured_duration_s",
            "minimum_recommended_samples",
            "minimum_recommended_duration_s",
            "warning_codes"
          ],
          "properties": {
            "quality": {
              "type": "string",
              "enum": ["unavailable", "low", "medium", "high"]
            },
            "sample_count": {
              "type": "integer",
              "minimum": 0
            },
            "measured_duration_s": {
              "type": "number",
              "minimum": 0
            },
            "minimum_recommended_samples": {
              "type": "integer",
              "minimum": 1
            },
            "minimum_recommended_duration_s": {
              "type": "number",
              "exclusiveMinimum": 0
            },
            "warning_codes": {
              "type": "array",
              "items": {
                "type": "string",
                "enum": [
                  "energy_unavailable",
                  "low_sample_count",
                  "short_duration",
                  "gross_energy_scope"
                ]
              },
              "uniqueItems": true
            }
          }
        }
      }
    },
    "performance": {
      "type": "object",
      "additionalProperties": false,
      "required": [
        "input_tokens",
        "output_tokens",
        "tokens_per_second",
        "error_count"
      ],
      "properties": {
        "input_tokens": {
          "type": "integer",
          "minimum": 0
        },
        "output_tokens": {
          "type": "integer",
          "minimum": 0
        },
        "tokens_per_second": {
          "type": "number",
          "minimum": 0
        },
        "error_count": {
          "type": "integer",
          "minimum": 0
        }
      }
    },
    "verification": {
      "type": "object",
      "additionalProperties": false,
      "required": ["level", "runner_version"],
      "properties": {
        "level": {
          "type": "integer",
          "minimum": 0,
          "maximum": 4
        },
        "runner_version": {
          "type": "string",
          "minLength": 1
        }
      }
    }
  },
  "$defs": {
    "tci_category": {
      "type": "object",
      "additionalProperties": false,
      "required": ["category_weight", "category_score", "benchmarks"],
      "properties": {
        "category_weight": {
          "type": "number",
          "minimum": 0,
          "maximum": 1
        },
        "category_score": {
          "type": "number",
          "minimum": 0,
          "maximum": 100
        },
        "benchmarks": {
          "type": "array",
          "items": {
            "type": "object",
            "additionalProperties": false,
            "required": [
              "task_id",
              "raw_benchmark_score",
              "normalized_benchmark_score"
            ],
            "properties": {
              "task_id": {
                "type": "string",
                "minLength": 1
              },
              "raw_benchmark_score": {
                "type": "number",
                "minimum": 0,
                "maximum": 1
              },
              "normalized_benchmark_score": {
                "type": "number",
                "minimum": 0,
                "maximum": 100
              }
            }
          }
        }
      }
    }
  }
}
